{
  "alternatives": [
    "Keep the previous interpretation unchanged."
  ],
  "change": "Every request enters the shared queue; use one pickup checklist while branches choose contact methods.",
  "commit_id": "TXN-000009",
  "created_at": "2026-09-23T12:09:00Z",
  "evidence_gap": null,
  "format_version": "1",
  "id": "SYS-RULE-0011.r4",
  "instance_id": "alm.synthetic.example",
  "kind": "revision",
  "number": 4,
  "predecessor_id": "SYS-RULE-0011.r3",
  "reason": "Add a shared pickup handoff while preserving Riverside's pinned variation.",
  "record_id": "SYS-RULE-0011",
  "scope_id": "GLOBAL",
  "snapshot": {
    "assertion": {
      "adoption_evidence": [],
      "asserted_by": "principal:synthetic-user",
      "kind": "user-stated",
      "reliability_note": "Fictional teaching scenario; these people and documents do not exist."
    },
    "conditions": [],
    "confidence": 1.0,
    "confidence_basis": "Clear fictional speaker statement; this score describes interpretation, not factual truth.",
    "consequences": [],
    "edges": {},
    "importance": "high",
    "parent_bases": [],
    "statement": "Every request enters the shared queue; use one pickup checklist while branches choose contact methods.",
    "status": "active",
    "title": "Lending request rule",
    "triggers": [],
    "type": "rule",
    "valid_from": "2026-09-23T11:09:00Z",
    "valid_time_note": null,
    "valid_until": null,
    "why": "A common checklist helps substitute volunteers without removing local access options."
  },
  "snapshot_sha256": "69ace11da3647f882a325765597115f1b85479c995aeeabd1f79129f2562e89e",
  "source_refs": [
    "win://WIN-00009"
  ],
  "time_note": null
}
