{
  "alternatives": [
    "Keep the previous interpretation unchanged."
  ],
  "change": "Accept lending requests by email during the pilot.",
  "commit_id": "TXN-000001",
  "created_at": "2026-09-23T12:01:00Z",
  "evidence_gap": null,
  "format_version": "1",
  "id": "SYS-RULE-0011.r1",
  "instance_id": "alm.synthetic.example",
  "kind": "revision",
  "number": 1,
  "predecessor_id": null,
  "reason": "Start with one manageable inbox for the pilot.",
  "record_id": "SYS-RULE-0011",
  "scope_id": "GLOBAL",
  "snapshot": {
    "assertion": {
      "adoption_evidence": [],
      "asserted_by": "principal:synthetic-user",
      "kind": "user-stated",
      "reliability_note": "Fictional teaching scenario; these people and documents do not exist."
    },
    "conditions": [],
    "confidence": 1.0,
    "confidence_basis": "Clear fictional speaker statement; this score describes interpretation, not factual truth.",
    "consequences": [],
    "edges": {},
    "importance": "high",
    "parent_bases": [],
    "statement": "Accept lending requests by email during the pilot.",
    "status": "active",
    "title": "Lending request rule",
    "triggers": [],
    "type": "rule",
    "valid_from": "2026-09-23T11:01:00Z",
    "valid_time_note": null,
    "valid_until": null,
    "why": "Two volunteers can manage one inbox while the pilot begins."
  },
  "snapshot_sha256": "f0d4698501ed3073aa44f40fa10431d45093c14b38f2f7e65c083a177352e45e",
  "source_refs": [
    "win://WIN-00001"
  ],
  "time_note": null
}
