{
  "alternatives": [
    "Keep the previous interpretation unchanged."
  ],
  "change": "At Riverside, volunteers may confirm pickups by phone and enter them in the shared queue.",
  "commit_id": "TXN-000006",
  "created_at": "2026-09-23T12:06:00Z",
  "evidence_gap": null,
  "format_version": "1",
  "id": "LIB-RULE-0005.r1",
  "instance_id": "alm.synthetic.example",
  "kind": "revision",
  "number": 1,
  "predecessor_id": null,
  "reason": "Keep the shared queue and record the branch's chosen contact method.",
  "record_id": "LIB-RULE-0005",
  "scope_id": "PROJECT-LIBRARY",
  "snapshot": {
    "assertion": {
      "adoption_evidence": [],
      "asserted_by": "principal:synthetic-user",
      "kind": "user-stated",
      "reliability_note": "Fictional teaching scenario; these people and documents do not exist."
    },
    "conditions": [],
    "confidence": 1.0,
    "confidence_basis": "Clear fictional speaker statement; this score describes interpretation, not factual truth.",
    "consequences": [],
    "edges": {},
    "importance": "high",
    "parent_bases": [
      {
        "derivative_kind": "specialization",
        "differences": [
          "Riverside may confirm pickups by phone for members without email."
        ],
        "inherited_portion": "Every request remains in the shared queue.",
        "reason": "Keep the branch reachable without losing reservation records.",
        "record_id": "SYS-RULE-0011",
        "registration_state": "pending",
        "revision_id": "SYS-RULE-0011.r3"
      }
    ],
    "statement": "At Riverside, volunteers may confirm pickups by phone and enter them in the shared queue.",
    "status": "active",
    "title": "Riverside phone confirmation",
    "triggers": [],
    "type": "rule",
    "valid_from": "2026-09-23T11:06:00Z",
    "valid_time_note": null,
    "valid_until": null,
    "why": "Some members cannot receive email; the shared queue still prevents double promises."
  },
  "snapshot_sha256": "b64af55cbe26e60553872d5aab6a21082e18b3374e93e3ad1bb82c92ae9e8409",
  "source_refs": [
    "win://WIN-00006"
  ],
  "time_note": null
}
