{
  "alternatives": [
    "Keep the previous interpretation unchanged."
  ],
  "change": "Hold a repair workshop when a room and instructor are available.",
  "commit_id": "TXN-000004",
  "created_at": "2026-09-23T12:04:00Z",
  "evidence_gap": null,
  "format_version": "1",
  "id": "LIB-DEC-0001.r1",
  "instance_id": "alm.synthetic.example",
  "kind": "revision",
  "number": 1,
  "predecessor_id": null,
  "reason": "Record the requested future workshop without inventing a date.",
  "record_id": "LIB-DEC-0001",
  "scope_id": "PROJECT-LIBRARY",
  "snapshot": {
    "assertion": {
      "adoption_evidence": [],
      "asserted_by": "principal:synthetic-user",
      "kind": "user-stated",
      "reliability_note": "Fictional teaching scenario; these people and documents do not exist."
    },
    "conditions": [],
    "confidence": 1.0,
    "confidence_basis": "Clear fictional speaker statement; this score describes interpretation, not factual truth.",
    "consequences": [],
    "edges": {},
    "importance": "high",
    "parent_bases": [],
    "statement": "Hold a repair workshop when a room and instructor are available.",
    "status": "active",
    "title": "Repair workshop",
    "triggers": [],
    "type": "decision",
    "valid_from": "2026-09-23T11:04:00Z",
    "valid_time_note": null,
    "valid_until": null,
    "why": "Members requested it, but the date and resources remain open."
  },
  "snapshot_sha256": "d14e13dad975a34fb79d7e1c95afb8749558d744730b9a77183be5a1be3cadf9",
  "source_refs": [
    "win://WIN-00004"
  ],
  "time_note": null
}
