{
  "alternatives": [
    "Keep the previous interpretation unchanged."
  ],
  "change": "Publish a large-print weekly lending and event schedule at the desk.",
  "commit_id": "TXN-000018",
  "created_at": "2026-09-23T12:18:00Z",
  "evidence_gap": null,
  "format_version": "1",
  "id": "SYS-RULE-0010.r1",
  "instance_id": "alm.synthetic.example",
  "kind": "revision",
  "number": 1,
  "predecessor_id": null,
  "reason": "Assistant proposal was adopted by the user's next turn; direct revision evidence will be enriched later.",
  "record_id": "SYS-RULE-0010",
  "scope_id": "GLOBAL",
  "snapshot": {
    "assertion": {
      "adoption_evidence": [
        "win://WIN-00019"
      ],
      "asserted_by": "principal:assistant",
      "kind": "AI-inferred",
      "reliability_note": "Fictional teaching scenario; these people and documents do not exist."
    },
    "conditions": [],
    "confidence": 1.0,
    "confidence_basis": "Clear fictional speaker statement; this score describes interpretation, not factual truth.",
    "consequences": [],
    "edges": {},
    "importance": "high",
    "parent_bases": [],
    "statement": "Publish a large-print weekly lending and event schedule at the desk.",
    "status": "active",
    "title": "Large-print weekly schedule",
    "triggers": [],
    "type": "rule",
    "valid_from": "2026-09-23T11:18:00Z",
    "valid_time_note": null,
    "valid_until": null,
    "why": "Members who miss email and volunteers answering calls need the same visible information."
  },
  "snapshot_sha256": "c3b91e860524b8a736ddf303700a42926a077f94d6606b99637b3efbd0745820",
  "source_refs": [
    "win://WIN-00018"
  ],
  "time_note": null
}
